{
  "$schema": "http://json-schema.org/draft-07/schema#",
  "title": "transcript-mining record (one per corpus item)",
  "type": "object",
  "additionalProperties": false,
  "required": [
    "item_id", "session_id", "is_subagent", "parent_session_id",
    "first_ts", "last_ts",
    "directive_violations", "skill_routing_misses", "improvement_signals",
    "decision_candidates", "tainan_corrections", "skill_gaps",
    "session_meta", "knowledge_nuggets"
  ],
  "properties": {
    "item_id": {
      "type": "string",
      "description": "EXACT corpus filename without .txt. For a split session this ends in __partNN. Copy it verbatim from the header line of the corpus file / from todo.txt."
    },
    "session_id": { "type": "string", "description": "Copy the `SESSION <id>` value from the corpus header." },
    "is_subagent": { "type": "boolean" },
    "parent_session_id": { "type": ["string", "null"] },
    "first_ts": { "type": "string", "description": "ISO8601. For a split item use the part_window start; otherwise the session window start." },
    "last_ts": { "type": "string", "description": "ISO8601. Part window end, or session window end." },

    "directive_violations": {
      "type": "array",
      "description": "Places where the agent broke a rule written in rubric/CLAUDE.md. Empty array if none.",
      "items": {
        "type": "object",
        "additionalProperties": false,
        "required": ["rule", "evidence_quote", "severity"],
        "properties": {
          "rule": { "type": "string", "description": "The CLAUDE.md section or rule name, e.g. 'Supabase Production Database — NEVER write directly' or 'CI green merge policy — STRICT'." },
          "evidence_quote": { "type": "string", "maxLength": 400, "description": "VERBATIM substring copied from the transcript that shows the violation. Never paraphrase. Never invent." },
          "evidence_pointer": { "type": "string", "description": "<item_id>@<ISO timestamp of the transcript line>." },
          "severity": { "type": "string", "enum": ["low", "med", "high"] }
        }
      }
    },

    "skill_routing_misses": {
      "type": "array",
      "description": "The agent hand-rolled something that a skill in rubric/skills-index.md already covers. Empty array if none.",
      "items": {
        "type": "object",
        "additionalProperties": false,
        "required": ["skill", "what_was_run_instead", "why_plausible"],
        "properties": {
          "skill": { "type": "string", "description": "EXACT skill name from rubric/skills-index.md. Never invent a skill name." },
          "what_was_run_instead": { "type": "string", "maxLength": 300, "description": "The actual command / tool sequence, quoted from the transcript." },
          "why_plausible": { "type": "string", "maxLength": 400, "description": "The QUALITATIVE why: what made the agent miss the skill here. Discoverability? Wrong trigger words? The skill looked heavier than the task? Partial overlap? Be specific to THIS transcript." },
          "evidence_pointer": { "type": "string" }
        }
      }
    },

    "improvement_signals": {
      "type": "array",
      "description": "Recurring friction inside this item that suggests a rule, skill or tooling change. Empty array if none.",
      "items": {
        "type": "object",
        "additionalProperties": false,
        "required": ["friction", "proposed_change"],
        "properties": {
          "friction": { "type": "string", "maxLength": 400, "description": "What kept going wrong, with a quoted trace." },
          "proposed_change": { "type": "string", "maxLength": 300, "description": "A concrete rule/skill/tool change that would remove it." },
          "recurrence_in_item": { "type": "integer", "minimum": 1 },
          "evidence_pointer": { "type": "string" }
        }
      }
    },

    "decision_candidates": {
      "type": "array",
      "description": "Durable decisions made in this item that belong in a decision record. NOT task chatter.",
      "items": {
        "type": "object",
        "additionalProperties": false,
        "required": ["decision_text", "date", "decided_by", "domain", "evidence_pointer"],
        "properties": {
          "decision_text": { "type": "string", "maxLength": 400, "description": "One sentence, in the imperative or declarative. What was decided." },
          "date": { "type": "string", "description": "YYYY-MM-DD from the transcript timestamp." },
          "decided_by": { "type": "string", "description": "'tainan' | 'agent' | 'tainan+agent' | a named person." },
          "domain": { "type": "string", "enum": ["financing", "itera", "amb-hq", "infra", "book", "dfl-app", "harness", "other"] },
          "evidence_pointer": { "type": "string", "description": "<item_id>@<ISO timestamp>. A POINTER ONLY — never paste a transcript dump here." }
        }
      }
    },

    "tainan_corrections": {
      "type": "array",
      "description": "Every moment Tainan corrected, overruled, or pushed back on the agent. USER messages only. Empty array for subagent items (Tainan is not present there).",
      "items": {
        "type": "object",
        "additionalProperties": false,
        "required": ["quote", "topic"],
        "properties": {
          "quote": { "type": "string", "maxLength": 400, "description": "VERBATIM from a USER message. Keep the original language (Portuguese stays Portuguese)." },
          "topic": { "type": "string", "maxLength": 160, "description": "What the correction was about, in a short noun phrase." },
          "evidence_pointer": { "type": "string" }
        }
      }
    },

    "skill_gaps": {
      "type": "array",
      "description": "A repeated multi-step bash/tool shape with NO covering skill in rubric/skills-index.md. If a skill covers it, that is a skill_routing_miss, not a gap.",
      "items": {
        "type": "object",
        "additionalProperties": false,
        "required": ["command_shape", "count_in_session", "description"],
        "properties": {
          "command_shape": { "type": "string", "maxLength": 300, "description": "The generalized shape, e.g. 'ssh dokploy-vps -> docker ps | grep <app> -> docker logs --tail'." },
          "count_in_session": { "type": "integer", "minimum": 1 },
          "description": { "type": "string", "maxLength": 300, "description": "What the shape accomplishes and why a skill would help." }
        }
      }
    },

    "session_meta": {
      "type": "object",
      "additionalProperties": false,
      "required": ["domain", "type", "outcome", "links"],
      "properties": {
        "domain": { "type": "string", "enum": ["financing", "itera", "amb-hq", "infra", "book", "dfl-app", "harness", "other"] },
        "type": { "type": "string", "enum": ["bugfix", "feature", "ops", "research", "talk"] },
        "outcome": { "type": "string", "enum": ["pr_merged", "abandoned", "blocked", "talk_only"] },
        "links": { "type": "array", "items": { "type": "string" }, "description": "PR URLs, plan slugs/URLs, issue URLs that appear in the transcript. Verbatim. Max 15." },
        "one_line_summary": { "type": "string", "maxLength": 240 }
      }
    },

    "knowledge_nuggets": {
      "type": "array",
      "description": "Durable, reusable facts learned here — a footgun, a mechanism, a constraint. NOT task status.",
      "items": {
        "type": "object",
        "additionalProperties": false,
        "required": ["claim", "where_it_belongs"],
        "properties": {
          "claim": { "type": "string", "maxLength": 400, "description": "The fact, stated so it is useful without the transcript." },
          "where_it_belongs": { "type": "string", "maxLength": 200, "description": "CLAUDE.md section, a claude-md/ companion doc, a specific skill, a repo README, or 'knowledge-tree'." },
          "evidence_pointer": { "type": "string" }
        }
      }
    }
  }
}
